A1: (C:\Inetpub\Utilization\Ut_Data\shift.htm )
A3: 2006 年 02 月份生產部(排)輪班表 (第2版)
B4: 1 | C4: 2 | D4: 3 | E4: 4 | F4: 5 | G4: 6 | H4: 7 | I4: 8 | J4: 9 | K4: 10 | L4: 11 | M4: 12 | N4: 13 | O4: 14 | P4: 15 | Q4: 16 | R4: 17 | S4: 18 | T4: 19 | U4: 20 | V4: 21 | W4: 22 | X4: 23 | Y4: 24 | Z4: 25 | AA4: 26 | AB4: 27 | AC4: 28 | AD4: 假數
A5: 星期( ) | B5: 三 | C5: 四 | D5: 五 | E5: 六 | F5: 日 | G5: 一 | H5: 二 | I5: 三 | J5: 四 | K5: 五 | L5: 六 | M5: 日 | N5: 一 | O5: 二 | P5: 三 | Q5: 四 | R5: 五 | S5: 六 | T5: 日 | U5: 一 | V5: 二 | W5: 三 | X5: 四 | Y5: 五 | Z5: 六 | AA5: 日 | AB5: 一 | AC5: 二
A6: A 班 | B6: 0 | C6: 0 | D6: 1 | E6: 1 | F6: 2 | G6: 2 | H6: 3 | I6: 3 | J6: 0 | K6: 0 | L6: 1 | M6: 1 | N6: 2 | O6: 2 | P6: 3 | Q6: 3 | R6: 0 | S6: 0 | T6: 1 | U6: 1 | V6: 2 | W6: 2 | X6: 3 | Y6: 3 | Z6: 0 | AA6: 0 | AB6: 1 | AC6: 1 | AD6: 11
A7: 林威志 | B7: 0 | C7: 0 | D7: 0 | E7: 0 | F7: 0 | G7: 1 | H7: 1 | I7: 1 | J7: 0 | K7: 0 | L7: 1 | M7: 1 | N7: 2 | O7: 2 | P7: 3 | Q7: 3 | R7: 0 | S7: 0 | T7: 1 | U7: 1 | V7: 2 | W7: 2 | X7: 3 | Y7: 3 | Z7: 0 | AA7: 0 | AB7: 1 | AC7: 1 | AD7: 11 | AE7: =11-AD7 -> 0
A8: 江振隆 | B8: 0 | C8: 0 | D8: 1 | E8: 1 | F8: 2 | G8: 2 | H8: 3 | I8: 3 | J8: 0 | K8: 0 | L8: 1 | M8: 1 | N8: 2 | O8: 2 | P8: 3 | Q8: 3 | R8: 0 | S8: 0 | T8: 1 | U8: 1 | V8: 2 | W8: 2 | X8: 3 | Y8: 3 | Z8: 0 | AA8: 0 | AB8: 1 | AC8: 1 | AD8: 8 | AE8: =11-AD8 -> 3
A9: 林季彥 | B9: 0 | C9: 0 | D9: 0 | E9: 0 | F9: 0 | G9: 1 | H9: 1 | I9: 1 | J9: 0 | K9: 0 | L9: 1 | M9: 1 | N9: 2 | O9: 2 | P9: 3 | Q9: 3 | R9: 0 | S9: 0 | T9: 1 | U9: 1 | V9: 2 | W9: 2 | X9: 3 | Y9: 3 | Z9: 0 | AA9: 0 | AB9: 1 | AC9: 1 | AD9: 11 | AE9: =11-AD9 -> 0
A10: 童茂原 | B10: 0 | C10: 0 | D10: 0 | E10: 0 | F10: 0 | G10: 1 | H10: 1 | I10: 1 | J10: 0 | K10: 0 | L10: 1 | M10: 1 | N10: 2 | O10: 2 | P10: 3 | Q10: 3 | R10: 0 | S10: 0 | T10: 1 | U10: 1 | V10: 2 | W10: 2 | X10: 3 | Y10: 3 | Z10: 0 | AA10: 0 | AB10: 1 | AC10: 1 | AD10: 11 | AE10: =11-AD10 -> 0
A11: 洪永坤 | B11: 0 | C11: 0 | D11: 0 | E11: 0 | F11: 0 | G11: 1 | H11: 1 | I11: 1 | J11: 0 | K11: 0 | L11: 1 | M11: 1 | N11: 2 | O11: 2 | P11: 3 | Q11: 3 | R11: 0 | S11: 0 | T11: 1 | U11: 1 | V11: 2 | W11: 2 | X11: 3 | Y11: 3 | Z11: 0 | AA11: 0 | AB11: 1 | AC11: 1 | AD11: 11 | AE11: =11-AD11 -> 0
A12: B 班 | B12: 1 | C12: 1 | D12: 2 | E12: 2 | F12: 3 | G12: 3 | H12: 0 | I12: 0 | J12: 1 | K12: 1 | L12: 2 | M12: 2 | N12: 3 | O12: 3 | P12: 0 | Q12: 0 | R12: 1 | S12: 1 | T12: 2 | U12: 2 | V12: 3 | W12: 3 | X12: 0 | Y12: 0 | Z12: 1 | AA12: 1 | AB12: 2 | AC12: 2 | AD12: 11
A13: 楊榮豪 | B13: 0 | C13: 0 | D13: 0 | E13: 0 | F13: 0 | G13: 1 | H13: 1 | I13: 0 | J13: 1 | K13: 1 | L13: 2 | M13: 2 | N13: 3 | O13: 3 | P13: 0 | Q13: 0 | R13: 1 | S13: 1 | T13: 2 | U13: 2 | V13: 3 | W13: 3 | X13: 0 | Y13: 0 | Z13: 1 | AA13: 1 | AB13: 2 | AC13: 2 | AD13: 10 | AE13: =11-AD13 -> 1
A14: 施添勝 | B14: 0 | C14: 0 | D14: 0 | E14: 0 | F14: 0 | G14: 1 | H14: 1 | I14: 0 | J14: 0 | K14: 1 | L14: 2 | M14: 2 | N14: 3 | O14: 3 | P14: 0 | Q14: 0 | R14: 1 | S14: 1 | T14: 2 | U14: 2 | V14: 3 | W14: 3 | X14: 0 | Y14: 0 | Z14: 1 | AA14: 1 | AB14: 2 | AC14: 2 | AD14: 11 | AE14: =11-AD14 -> 0
A15: 李宗晏 | B15: 1 | C15: 1 | D15: 2 | E15: 2 | F15: 3 | G15: 3 | H15: 0 | I15: 0 | J15: 0 | K15: 1 | L15: 2 | M15: 2 | N15: 3 | O15: 3 | P15: 0 | Q15: 0 | R15: 1 | S15: 1 | T15: 2 | U15: 2 | V15: 3 | W15: 3 | X15: 0 | Y15: 0 | Z15: 1 | AA15: 1 | AB15: 2 | AC15: 2 | AD15: 7 | AE15: =11-AD15 -> 4
A16: 林建志 | B16: 0 | C16: 0 | D16: 0 | E16: 0 | F16: 0 | G16: 1 | H16: 1 | I16: 0 | J16: 1 | K16: 1 | L16: 2 | M16: 2 | N16: 3 | O16: 3 | P16: 0 | Q16: 0 | R16: 1 | S16: 1 | T16: 2 | U16: 2 | V16: 3 | W16: 3 | X16: 0 | Y16: 0 | Z16: 1 | AA16: 1 | AB16: 2 | AC16: 2 | AD16: 10 | AE16: =11-AD16 -> 1
A17: 鄭伯倫 | B17: 0 | C17: 0 | D17: 0 | E17: 0 | F17: 0 | G17: 1 | H17: 1 | I17: 0 | J17: 1 | K17: 1 | L17: 2 | M17: 2 | N17: 3 | O17: 3 | P17: 0 | Q17: 0 | R17: 1 | S17: 1 | T17: 2 | U17: 2 | V17: 3 | W17: 3 | X17: 0 | Y17: 0 | Z17: 1 | AA17: 1 | AB17: 2 | AC17: 2 | AD17: 10 | AE17: =11-AD17 -> 1
A18: C 班 | B18: 2 | C18: 2 | D18: 3 | E18: 3 | F18: 0 | G18: 0 | H18: 1 | I18: 1 | J18: 2 | K18: 2 | L18: 3 | M18: 3 | N18: 0 | O18: 0 | P18: 1 | Q18: 1 | R18: 2 | S18: 2 | T18: 3 | U18: 3 | V18: 0 | W18: 0 | X18: 1 | Y18: 1 | Z18: 2 | AA18: 2 | AB18: 3 | AC18: 3 | AD18: 11
A19: 朱鴻明 | B19: 0 | C19: 0 | D19: 0 | E19: 0 | F19: 0 | G19: 0 | H19: 0 | I19: 1 | J19: 1 | K19: 2 | L19: 3 | M19: 3 | N19: 0 | O19: 0 | P19: 1 | Q19: 1 | R19: 2 | S19: 2 | T19: 3 | U19: 3 | V19: 0 | W19: 0 | X19: 1 | Y19: 1 | Z19: 2 | AA19: 2 | AB19: 3 | AC19: 3 | AD19: 11 | AE19: =11-AD19 -> 0
A20: 鄭信發 | B20: 2 | C20: 2 | D20: 3 | E20: 3 | F20: 0 | G20: 0 | H20: 1 | I20: 0 | J20: 0 | K20: 2 | L20: 3 | M20: 3 | N20: 0 | O20: 0 | P20: 1 | Q20: 1 | R20: 2 | S20: 2 | T20: 3 | U20: 3 | V20: 0 | W20: 0 | X20: 1 | Y20: 1 | Z20: 2 | AA20: 2 | AB20: 3 | AC20: 3 | AD20: 8 | AE20: =11-AD20 -> 3
A21: 楊漢璋 | B21: 0 | C21: 0 | D21: 0 | E21: 0 | F21: 0 | G21: 0 | H21: 0 | I21: 1 | J21: 1 | K21: 2 | L21: 3 | M21: 3 | N21: 0 | O21: 0 | P21: 1 | Q21: 1 | R21: 2 | S21: 2 | T21: 3 | U21: 3 | V21: 0 | W21: 0 | X21: 1 | Y21: 1 | Z21: 2 | AA21: 2 | AB21: 3 | AC21: 3 | AD21: 11 | AE21: =11-AD21 -> 0
A22: 林金龍 | B22: 0 | C22: 0 | D22: 0 | E22: 0 | F22: 0 | G22: 0 | H22: 0 | I22: 1 | J22: 2 | K22: 2 | L22: 3 | M22: 3 | N22: 0 | O22: 0 | P22: 1 | Q22: 1 | R22: 2 | S22: 2 | T22: 3 | U22: 3 | V22: 0 | W22: 0 | X22: 1 | Y22: 1 | Z22: 2 | AA22: 2 | AB22: 3 | AC22: 3 | AD22: 11 | AE22: =11-AD22 -> 0
A23: 卓志偉 | B23: 0 | C23: 0 | D23: 0 | E23: 0 | F23: 0 | G23: 0 | H23: 0 | I23: 1 | J23: 1 | K23: 2 | L23: 3 | M23: 3 | N23: 0 | O23: 0 | P23: 1 | Q23: 1 | R23: 2 | S23: 2 | T23: 3 | U23: 3 | V23: 0 | W23: 0 | X23: 1 | Y23: 1 | Z23: 2 | AA23: 2 | AB23: 3 | AC23: 3 | AD23: 11 | AE23: =11-AD23 -> 0
A24: D 班 | B24: 3 | C24: 3 | D24: 0 | E24: 0 | F24: 1 | G24: 1 | H24: 2 | I24: 2 | J24: 3 | K24: 3 | L24: 0 | M24: 0 | N24: 1 | O24: 1 | P24: 2 | Q24: 2 | R24: 3 | S24: 3 | T24: 0 | U24: 0 | V24: 1 | W24: 1 | X24: 2 | Y24: 2 | Z24: 3 | AA24: 3 | AB24: 0 | AC24: 0 | AD24: 11
A25: 毛志賢 | B25: 0 | C25: 0 | D25: 0 | E25: 0 | F25: 0 | G25: 1 | H25: 1 | I25: 1 | J25: 1 | K25: 3 | L25: 0 | M25: 0 | N25: 1 | O25: 1 | P25: 2 | Q25: 2 | R25: 3 | S25: 3 | T25: 0 | U25: 0 | V25: 1 | W25: 1 | X25: 2 | Y25: 2 | Z25: 3 | AA25: 3 | AB25: 0 | AC25: 0 | AD25: 11 | AE25: =11-AD25 -> 0
A26: 陳信昌 | B26: 0 | C26: 0 | D26: 0 | E26: 0 | F26: 1 | G26: 1 | H26: 1 | I26: 1 | J26: 3 | K26: 3 | L26: 0 | M26: 0 | N26: 1 | O26: 1 | P26: 2 | Q26: 2 | R26: 3 | S26: 3 | T26: 0 | U26: 0 | V26: 1 | W26: 1 | X26: 2 | Y26: 2 | Z26: 3 | AA26: 3 | AB26: 0 | AC26: 0 | AD26: 10 | AE26: =11-AD26 -> 1
A27: 洪銘駿 | B27: 3 | C27: 3 | D27: 0 | E27: 0 | F27: 0 | G27: 1 | H27: 2 | I27: 2 | J27: 0 | K27: 3 | L27: 0 | M27: 0 | N27: 1 | O27: 1 | P27: 2 | Q27: 2 | R27: 3 | S27: 3 | T27: 0 | U27: 0 | V27: 1 | W27: 1 | X27: 2 | Y27: 2 | Z27: 3 | AA27: 3 | AB27: 0 | AC27: 0 | AD27: 10 | AE27: =11-AD27 -> 1
A28: 許舜南 | B28: 0 | C28: 0 | D28: 0 | E28: 0 | F28: 0 | G28: 1 | H28: 1 | I28: 1 | J28: 1 | K28: 3 | L28: 0 | M28: 0 | N28: 1 | O28: 1 | P28: 2 | Q28: 2 | R28: 3 | S28: 3 | T28: 0 | U28: 0 | V28: 1 | W28: 1 | X28: 2 | Y28: 2 | Z28: 3 | AA28: 3 | AB28: 0 | AC28: 0 | AD28: 11 | AE28: =11-AD28 -> 0
A29: 陳致炫 | B29: 0 | C29: 0 | D29: 0 | E29: 0 | F29: 0 | G29: 1 | H29: 1 | I29: 1 | J29: 1 | K29: 3 | L29: 0 | M29: 0 | N29: 1 | O29: 1 | P29: 2 | Q29: 2 | R29: 3 | S29: 3 | T29: 0 | U29: 0 | V29: 1 | W29: 1 | X29: 2 | Y29: 2 | Z29: 3 | AA29: 3 | AB29: 0 | AC29: 0 | AD29: 11 | AE29: =11-AD29 -> 0
A30: 0=排休 1=早班 2=中班 3=晚班 常日班( 0800-1700) *請假及調班請標示於本表並填單簽准送人事統計出勤.
A31: *因過年期間跨月,故假日以一月加上二月總假日數為基準,以利排班調整.